{"schema_version":"1.0.0","run_id":"dc6b69acd21846de92b190249f63d420","timestamp":"2026-08-01T16:52:12.719066Z","commit_sha":"unknown","model":"/opt/clusius/models/model-Q8_0.gguf","model_hash":"Qwen/Qwen2.5-0.5B-Instruct","backend":"llamacpp","quant":"Q8_0","instance_type":"c4a-standard-2","arch":"aarch64","price_per_hour":0.0898,"threads":2,"core_pinning":false,"batch_size":4,"kv_cache_precision":"fp16","context_length":2048,"concurrency":2,"throughput":{"tokens_per_second":124.30277497295761,"requests_per_second":0.4093395443675881},"latency_ms":{"ttft_p50":145.0634759999616,"inter_token_p50":14.22896200000423,"p50":5753.490380000017,"p95":6413.500847999956,"p99":6413.500847999956},"cost_per_1m_tokens":0.20067487994432284,"accuracy_score":1.0}