{"schema_version":"1.0.0","run_id":"fa91552690084f499d8887909b595b4c","timestamp":"2026-08-03T03:34:51.982585Z","commit_sha":"unknown","model":"/opt/clusius/models/model-Q8_0.gguf","model_hash":"TinyLlama/TinyLlama-1.1B-Chat-v1.0","backend":"llamacpp","quant":"Q8_0","instance_type":"c4a-standard-2","arch":"aarch64","price_per_hour":0.0898,"threads":1,"core_pinning":true,"batch_size":4,"kv_cache_precision":"int8","context_length":2048,"concurrency":2,"throughput":{"tokens_per_second":34.89084733069344,"requests_per_second":0.20604831100803214},"latency_ms":{"ttft_p50":581.2259539961815,"inter_token_p50":48.45022299559787,"p50":8627.394957002252,"p95":14559.478134993697,"p99":14559.478134993697},"cost_per_1m_tokens":0.7149280213238286,"accuracy_score":1.0}