{"schema_version":"1.0.0","run_id":"4490aff075a245488abc067417761de0","timestamp":"2026-08-01T15:27:06.437259Z","commit_sha":"unknown","model":"/opt/clusius/models/model-Q8_0.gguf","model_hash":"Qwen/Qwen2.5-0.5B-Instruct","backend":"llamacpp","quant":"Q8_0","instance_type":"c4a-standard-2","arch":"aarch64","price_per_hour":0.0898,"threads":2,"core_pinning":true,"batch_size":4,"kv_cache_precision":"int8","context_length":2048,"concurrency":2,"throughput":{"tokens_per_second":91.7006594420225,"requests_per_second":0.4912535327251205},"latency_ms":{"ttft_p50":142.33492699986527,"inter_token_p50":13.477810000040336,"p50":3883.7485100002596,"p95":4470.106252999358,"p99":4470.106252999358},"cost_per_1m_tokens":0.27202033874375253,"accuracy_score":1.0}